{
  "source_url": "https://m.mobile.de/auto-inserat/renault-austral-evolution-150-shz-navi-keyless-pdc-kamer-wesel/455255173.html?ref=seo&refId=91653578-3c85-8e20-fd35-9fd76eebfc30&searchId=91653578-3c85-8e20-fd35-9fd76eebfc30&type=topAd",
  "source_id": "455255173",
  "scraped_at": "2026-07-05T09:58:57+00:00",
  "scrape_method": "chrome-cdp",
  "make": "Renault",
  "model": "Austral",
  "variant": "Evolution",
  "title_de": "Renault Austral Evolution 150*SHZ*NAVI*KEYLESS*PDC*KAMER",
  "year": null,
  "first_registration": null,
  "mileage_km": 50,
  "price_listed_eur": 31990.0,
  "price_is_gross": true,
  "vat_deductible": null,
  "fuel": "Benzina",
  "gearbox": "Automatico",
  "power_kw": 109,
  "power_hp": 148,
  "body_type": "SUV/Geländewagen/Pickup",
  "drivetrain": null,
  "doors": 5,
  "seats": 5,
  "color": null,
  "color_manufacturer": null,
  "interior": "Stoff, Andere",
  "emission_class": "Euro 6e",
  "co2_g_km": 148.0,
  "vin": null,
  "equipment_de": [
    "ABS",
    "Abstandstempomat",
    "Abstandswarner",
    "Berganfahrassistent",
    "Elektr. Fensterheber",
    "Elektr. Seitenspiegel",
    "Elektr. Wegfahrsperre",
    "ESP",
    "Frontantrieb",
    "Isofix",
    "LED-Scheinwerfer",
    "LED-Tagfahrlicht",
    "Leichtmetallfelgen",
    "Lichtsensor",
    "Müdigkeitswarner",
    "Notbremsassistent",
    "Notrufsystem",
    "Pannenkit",
    "Radio DAB",
    "Regensensor",
    "Reifendruckkontrolle",
    "Schaltwippen",
    "Soundsystem",
    "Spurhalteassistent",
    "Traktionskontrolle",
    "USB",
    "Verkehrszeichenerkennung",
    "Zentralverriegelung"
  ],
  "description_de": "Sonderausstattung \n Sitzheizung vorn\n Sonderlackierung Dolomit-Grau / Schiefer-Grau Metallic\n \n\n Serienausstattung \n Adaptive Geschwindigkeitsregelanlage (ACC)\n Airbag Beifahrerseite\n Airbag Beifahrerseite abschaltbar\n Airbag Fahrerseite\n Anti-Blockier-System (ABS)\n Antriebsart: Frontantrieb\n Außenspiegel elektr. anklappbar\n Außenspiegel elektr. verstell- und heizbar\n Außenspiegel schwarz lackiert\n Dachantenne im Haifischflossen-Design\n Eco Mode (Fahrmodusschalter)\n Einparkhilfe vorn, hinten und seitlich mit Rückfahrkamera\n Elektr. Bremskraftverteilung\n Elektron. Stabilitäts-Programm (ESP)\n Fahrassistenz-System: Abstandswarner\n Fahrassistenz-System: Aktiver Notbrems-Assistent mit Fußgängererkennung\n Fahrassistenz-System: Berganfahr-Assistent (HSA)\n Fahrassistenz-System: Müdigkeitserkennungs-Sensor\n Fahrassistenz-System: Sicherheitssystem mit automatischem Notruf (ERA GLONASS / eCall)\n Fahrassistenz-System: Spurhalteassistent Aktiv\n Fahrassistenz-System: Verkehrszeichenerkennung\n Fensterheber elektr. mit Einklemmschutz\n Fensterheber elektr. mit Impulsgeber\n Fensterheber elektrisch vorn + hinten\n Geräuschsimulator (Außensound)\n Getriebe Automatik stufenlos - CVT\n Heckleuchten LED\n Heckscheibe heizbar\n 8 Lautsprecher\n Smartphone kabellose Schnittstelle (Apple CarPlay & Android Auto)\n Infotainment-System: OpenR link (9\" Touchscreen, Arkamys Classic Sound, DAB+) (8 Lautsprecher, Smartphone kabellose Schnittstelle (Apple CarPlay & Android Auto) )\n Ionisator zur Luftreinigung\n Isofix-Aufnahmen für Kindersitz\n Karosserie: 5-türig\n Keyless Go\n Kinderspiegel (zusätzlicher Innenspiegel für den Fond)\n Klimaautomatik 2-Zonen mit autom. Umluft-Control\n Kombiinstrument digital (12,3 Zoll)\n Kopf-Airbag-System hinten\n Kopf-Airbag-System vorn\n Kopfstützen hinten\n Lackierung Arktis-Weiß\n Lenkrad (Leder-Optik)\n Lenkrad mit Schaltwippen/-tasten\n Lenksäule (Lenkrad) höhenverstellbar\n Lenksäule (Lenkrad) längsverstellbar\n Licht- und Regensensor\n LM-Felgen\n Mild-Hybrid 109 kW (Motor 1,3 Ltr. - 109 kW)\n Mild-Hybrid-Technologie\n Mittelkonsole mit Armlehne und Staufach\n Modellpflege\n Parkbremse elektrisch mit Auto-Hold-Funktion\n Radstand 2667 mm\n Reifen-Reparaturkit\n Reifendruck-Kontrollsystem\n Rücksitzbank geteilt/klappbar (1/3-2/3)\n Schadstoffarm nach Abgasnorm Euro 6e\n Schaltpunktanzeige\n Scheinwerfer Full-LED mit LED-Signatur (Pure Vision)\n Seitenairbag vorn\n Seitenairbag vorn mitte (Center-Airbag)\n Sitz vorn links verstellbar (6-fach)\n Sitzbezug / Polsterung: Stoff\n Sonderlackierung Metallic Dezir Rot\n Sonnenblenden mit Spiegel (beleuchtet)\n Tagfahrlicht LED\n USB-Anschlüsse (Typ C) Mittelkonsole hinten\n USB-Anschlüsse (Typ C) Mittelkonsole vorn\n Warnanlage für Sicherheitsgurte\n Zentralverriegelung mit Fernbedienung",
  "raw_specs": {
    "Fahrzeugzustand": "Neufahrzeug, Unfallfrei",
    "Kategorie": "SUV/Geländewagen/Pickup",
    "Ausstattungslinie": "Evolution",
    "Fahrzeugnummer": "H0731E",
    "Verfügbarkeit": "Sofort",
    "Herkunft": "Deutsche Ausführung",
    "Kilometerstand": "50 km",
    "Hubraum": "1.332 cm³",
    "Leistung": "109 kW (148 PS)",
    "Antriebsart": "Verbrennungsmotor",
    "Kraftstoffart": "Benzin, E10-geeignet",
    "Energieverbrauch (komb.)": "6,5 l/100km",
    "CO₂-Emissionen (komb.)": "148 g/km",
    "CO₂-Klasse": "Auf Grundlage der CO₂-Emissionen (kombiniert)",
    "Kraftstoffverbrauch": "6,5 l/100km (kombiniert); 7,8 l/100km (Innenstadt); 6,1 l/100km (Stadtrand); 5,6 l/100km (Landstraße); 7,2 l/100km (Autobahn)",
    "Energiekosten bei 15.000 km Jahresfahrleistung": "1.696 €/Jahr",
    "Kraftstoffpreis": "1,74 €/l (Jahresdurchschnitt 2024)",
    "Mögliche CO₂-Kosten über die nächsten 10 Jahre (15.000 km/Jahr)": "2.819 € (bei einem angenommenen mittleren durchschnittlichen CO₂-Preis von 127 €/t); 1.332 € (bei einem angenommenen niedrigen durchschnittlichen CO₂-Preis von 60 €/t); 4.440 € (bei einem angenommenen hohen durchschnittlichen CO₂-Preis von 200 €/t)",
    "Kraftfahrzeugsteuer": "144 €/Jahr",
    "Anzahl Sitzplätze": "5",
    "Anzahl der Türen": "4/5",
    "Getriebe": "Automatik",
    "Schadstoffklasse": "Euro 6e",
    "Umweltplakette": "4 (Grün)",
    "Anzahl der Fahrzeughalter": "0",
    "Klimatisierung": "2-Zonen-Klimaautomatik",
    "Einparkhilfe": "Hinten, Kamera, Vorne",
    "Airbags": "Front-Airbags",
    "Innenausstattung": "Stoff, Andere",
    "Gewicht": "1.548 kg",
    "Zylinder": "4"
  },
  "seller": {},
  "images": [
    {
      "index": 0,
      "original_url": "https://img.classistatic.de/api/v1/mo-prod/images/03/03efef22-d339-43e4-a2bc-68410d60a0f9?rule=mo-1600",
      "local_path": "foto/00.jpg",
      "is_cover": true
    },
    {
      "index": 1,
      "original_url": "https://img.classistatic.de/api/v1/mo-prod/images/38/38fb5e87-bc3d-4aaf-bff1-569469e0defb?rule=mo-1600",
      "local_path": "foto/01.jpg",
      "is_cover": false
    },
    {
      "index": 2,
      "original_url": "https://img.classistatic.de/api/v1/mo-prod/images/8b/8b627028-93e4-4889-8931-335970db94de?rule=mo-1600",
      "local_path": "foto/02.jpg",
      "is_cover": false
    },
    {
      "index": 3,
      "original_url": "https://img.classistatic.de/api/v1/mo-prod/images/bc/bcb5dc8e-aba1-4697-99d3-904c4971c219?rule=mo-1600",
      "local_path": "foto/03.jpg",
      "is_cover": false
    },
    {
      "index": 4,
      "original_url": "https://img.classistatic.de/api/v1/mo-prod/images/a6/a6aa7c68-c968-4f74-b553-068c3e6d6ead?rule=mo-1600",
      "local_path": "foto/04.jpg",
      "is_cover": false
    },
    {
      "index": 5,
      "original_url": "https://img.classistatic.de/api/v1/mo-prod/images/57/57a80a3a-7c86-4f95-b558-a54358a9933c?rule=mo-1600",
      "local_path": "foto/05.jpg",
      "is_cover": false
    },
    {
      "index": 6,
      "original_url": "https://img.classistatic.de/api/v1/mo-prod/images/76/7607759f-1317-4420-9a2f-9f15edd2cbd7?rule=mo-1600",
      "local_path": "foto/06.jpg",
      "is_cover": false
    },
    {
      "index": 7,
      "original_url": "https://img.classistatic.de/api/v1/mo-prod/images/1a/1a89a0a9-2502-4e30-9c6d-8698eef771b5?rule=mo-1600",
      "local_path": "foto/07.jpg",
      "is_cover": false
    },
    {
      "index": 8,
      "original_url": "https://img.classistatic.de/api/v1/mo-prod/images/c0/c0a43d44-44b1-449b-9801-6b8207085e51?rule=mo-1600",
      "local_path": "foto/08.jpg",
      "is_cover": false
    },
    {
      "index": 9,
      "original_url": "https://img.classistatic.de/api/v1/mo-prod/images/f7/f787c44a-b7bf-4abc-8e34-ec7382225320?rule=mo-1600",
      "local_path": "foto/09.jpg",
      "is_cover": false
    },
    {
      "index": 10,
      "original_url": "https://img.classistatic.de/api/v1/mo-prod/images/d1/d11b258b-a02c-4185-8c1c-e30a89b57e7b?rule=mo-1600",
      "local_path": "foto/10.jpg",
      "is_cover": false
    },
    {
      "index": 11,
      "original_url": "https://img.classistatic.de/api/v1/mo-prod/images/f9/f9ce19ca-1873-4ef0-b0a7-97e68b79210f?rule=mo-1600",
      "local_path": "foto/11.jpg",
      "is_cover": false
    }
  ],
  "warnings": []
}