{
  "source_url": "https://suchen.mobile.de/fahrzeuge/details.html?id=447419300&sb=rel&od=up&vc=Car&dam=false&fr=2018&ml=%3A80000&ms=16700%3B%3B%3B&ms=4%3B%3B%3B&ms=1700%3B%3B%3B&ms=1900%3B%3B%3B&ms=3100%3B%3B%3B&ms=3500%3B%3B%3B&ms=4700%3B%3B%3B&ms=8600%3B%3B%3B&ms=270%3B%3B%3B&ms=14600%3B%3B%3B&ms=12400%3B%3B%3B&ms=11650%3B%3B%3B&ms=14800%3B%3B%3B&ms=15200%3B%3B%3B&ms=15500%3B%3B%3B&ms=15900%3B%3B%3B&ms=16600%3B%3B%3B&ms=17200%3B%3B%3B&ms=20100%3B%3B%3B&ms=21600%3B%3B%3B&ms=137%3B%3B%3B&p=35000&pa=CAM_360_DEGREES&pa=REAR_VIEW_CAM&s=Car&ref=srp&searchId=c750c3f0-83bb-fc94-9e70-bdb893464f75&refId=c750c3f0-83bb-fc94-9e70-bdb893464f75",
  "source_id": "447419300",
  "scraped_at": "2026-07-05T19:42:27+00:00",
  "scrape_method": "chrome-cdp",
  "make": "Audi",
  "model": "A6",
  "variant": "55 TFSI quattro sport",
  "title_de": "Audi A6 55 TFSI quattro S tronic sport 8-fach",
  "year": 2022,
  "first_registration": "10/2022",
  "mileage_km": 62000,
  "price_listed_eur": 38900.0,
  "price_is_gross": true,
  "vat_deductible": true,
  "fuel": "Benzina",
  "gearbox": "Automatico",
  "power_kw": 250,
  "power_hp": 340,
  "body_type": "Limousine",
  "drivetrain": "Integrale",
  "doors": 5,
  "seats": 5,
  "color": "Blau Metallic",
  "color_manufacturer": "FIRMAMENTBLAU",
  "interior": "Vollleder, Schwarz",
  "emission_class": "Euro6d",
  "co2_g_km": 193.0,
  "vin": null,
  "equipment_de": [
    "ABS",
    "Abstandstempomat",
    "Allradantrieb",
    "Ambiente-Beleuchtung",
    "Android Auto",
    "Apple CarPlay",
    "Armlehne",
    "Berganfahrassistent",
    "Bluetooth",
    "Bordcomputer",
    "Elektr. Fensterheber",
    "Elektr. Heckklappe",
    "Elektr. Seitenspiegel",
    "Elektr. Seitenspiegel anklappbar",
    "Elektr. Sitzeinstellung",
    "Elektr. Sitzeinstellung mit Memory-Funktion",
    "Elektr. Wegfahrsperre",
    "ESP",
    "Fernlichtassistent",
    "Freisprecheinrichtung",
    "Garantie",
    "Geschwindigkeitsbegrenzer",
    "Induktionsladen für Smartphones",
    "Innenspiegel autom. abblendend",
    "Inspektion neu",
    "Isofix",
    "Isofix Beifahrersitz",
    "Lederlenkrad",
    "LED-Scheinwerfer",
    "Leichtmetallfelgen",
    "Lordosenstütze",
    "Multifunktionslenkrad",
    "Navigationssystem",
    "Nichtraucher-Fahrzeug",
    "Notrufsystem",
    "Panorama-Dach",
    "Radio DAB",
    "Reifendruckkontrolle",
    "Schaltwippen",
    "Scheckheftgepflegt",
    "Schlüssellose Zentralverriegelung (Keyless)",
    "Servolenkung",
    "Sitzheizung",
    "Sommerreifen",
    "Soundsystem",
    "Start/Stopp-Automatik",
    "Tagfahrlicht",
    "Totwinkel-Assistent",
    "Touchscreen",
    "Traktionskontrolle",
    "Tuner/Radio",
    "USB",
    "Verkehrszeichenerkennung",
    "Volldigitales Kombiinstrument",
    "Winterreifen",
    "Zentralverriegelung"
  ],
  "description_de": "8-fach bereift\nNavigationssystem\nAllradantrieb \"quattro\"\nLED-Scheinwerfer\nAdaptiver Geschwindigkeitsassistent\nGeschwindigkeitsbeg.\nEffizienzassistent\nKomfortklimaautomatik 4- Zonen\nSitzheizung vorne\nAudi phone box\nWireless Charging\nInnenspiegel automatisch abblendend\nFernlichtassistent\nAudi sound system\nSpurwechselwarnung inkl. Audi pre sense rear\nAusstiegswarnung\nQuerverkehrassistent hinten\nGepäckraumklappe, elektrisch öffnend und schließend\nVordersitze elektrisch einstellbar inklusive Memory-Funktion für den Fahrersitz\nEinparkhilfe plus\nRückfahrkamera\nAußenspiegel elektrisch einstell-,beheiz- und anklappbar\nGetriebe: S tronic 7-Gang\n Anschlussgarantie bis max. 100.000km, endet 2027-06 \n Finanzierung möglich \n Nr. 3607 \n Unser Verkaufspreis beinhaltet TÜV / AU neu und die Durchführung aller etwaig anstehenden Servicearbeiten. Bitte haben Sie dafür Verständnis, dass wir auch einmal Fehler machen können. Wir behalten uns deshalb auch Eingabefehler und Irrtümer, insbesondere zu den technischen Angaben und zum angebotenen Ausstattungsumfang ausdrücklich vor. Vertragsgemäße Beschaffenheit ist nur die, welche bei Kaufabschluss vor Ort besichtigt und schriftlich zugesichert wurde. Bitte prüfen Sie die für Sie relevanten Angaben vor Kauf mit unserem Verkaufsteam.",
  "raw_specs": {
    "Fahrzeugzustand": "Gebrauchtfahrzeug, Unfallfrei",
    "Kategorie": "Limousine",
    "Baureihe": "4A2",
    "Ausstattungslinie": "55 TFSI quattro sport",
    "Fahrzeugnummer": "3607",
    "Herkunft": "Deutsche Ausführung",
    "Kilometerstand": "62.000 km",
    "Hubraum": "2.995 cm³",
    "Leistung": "250 kW (340 PS)",
    "Antriebsart": "Verbrennungsmotor",
    "Kraftstoffart": "Benzin",
    "Energieverbrauch (komb.)": "-- l/100km",
    "CO₂-Emissionen (komb.)": "193 g/km",
    "Anzahl Sitzplätze": "5",
    "Anzahl der Türen": "4/5",
    "Getriebe": "Automatik",
    "Schadstoffklasse": "Euro6d",
    "Umweltplakette": "4 (Grün)",
    "Erstzulassung": "10/2022",
    "Anzahl der Fahrzeughalter": "2",
    "HU": "Neu",
    "Klimatisierung": "4-Zonen-Klimaautomatik",
    "Einparkhilfe": "Vorne, Kamera, Hinten",
    "Airbags": "Front-, Seiten- und weitere Airbags",
    "Farbe (Hersteller)": "FIRMAMENTBLAU",
    "Farbe": "Blau Metallic",
    "Innenausstattung": "Vollleder, Schwarz",
    "Gewicht": "1.845 kg",
    "Zylinder": "6"
  },
  "seller": {},
  "images": [
    {
      "index": 0,
      "original_url": "https://img.classistatic.de/api/v1/mo-prod/images/03/03dd3884-5a1e-4b3e-882f-fb1ea6e4cf75?rule=mo-1600",
      "local_path": "foto/00.jpg",
      "is_cover": true
    },
    {
      "index": 1,
      "original_url": "https://img.classistatic.de/api/v1/mo-prod/images/fd/fd1e8de2-ae43-4b3d-b5fd-6cbd2268be10?rule=mo-1600",
      "local_path": "foto/01.jpg",
      "is_cover": false
    },
    {
      "index": 2,
      "original_url": "https://img.classistatic.de/api/v1/mo-prod/images/6b/6b0703d2-2d48-4e51-8f93-4b631f649f51?rule=mo-1600",
      "local_path": "foto/02.jpg",
      "is_cover": false
    },
    {
      "index": 3,
      "original_url": "https://img.classistatic.de/api/v1/mo-prod/images/49/496ae1c9-edaa-4c99-9aa7-c2f772317b70?rule=mo-1600",
      "local_path": "foto/03.jpg",
      "is_cover": false
    },
    {
      "index": 4,
      "original_url": "https://img.classistatic.de/api/v1/mo-prod/images/3f/3f41115b-826a-43b8-a9e6-dba23c8d3214?rule=mo-1600",
      "local_path": "foto/04.jpg",
      "is_cover": false
    },
    {
      "index": 5,
      "original_url": "https://img.classistatic.de/api/v1/mo-prod/images/ee/ee8639f3-7a24-4b7a-a69a-5d7f1f38faca?rule=mo-1600",
      "local_path": "foto/05.jpg",
      "is_cover": false
    },
    {
      "index": 6,
      "original_url": "https://img.classistatic.de/api/v1/mo-prod/images/37/37fc46f0-bea5-43a6-b5cc-4435e5ad1ef3?rule=mo-1600",
      "local_path": "foto/06.jpg",
      "is_cover": false
    },
    {
      "index": 7,
      "original_url": "https://img.classistatic.de/api/v1/mo-prod/images/e0/e001fd90-bd8c-4c3c-8960-e1d41c832458?rule=mo-1600",
      "local_path": "foto/07.jpg",
      "is_cover": false
    },
    {
      "index": 8,
      "original_url": "https://img.classistatic.de/api/v1/mo-prod/images/30/30e2ea09-ac1c-444e-93cf-c11aa0909d1e?rule=mo-1600",
      "local_path": "foto/08.jpg",
      "is_cover": false
    },
    {
      "index": 9,
      "original_url": "https://img.classistatic.de/api/v1/mo-prod/images/f1/f169727f-cf0b-422e-afc3-69f388dc4c57?rule=mo-1600",
      "local_path": "foto/09.jpg",
      "is_cover": false
    },
    {
      "index": 10,
      "original_url": "https://img.classistatic.de/api/v1/mo-prod/images/0f/0f1df9df-b642-4c64-8b66-e7fe45198b46?rule=mo-1600",
      "local_path": "foto/10.jpg",
      "is_cover": false
    },
    {
      "index": 11,
      "original_url": "https://img.classistatic.de/api/v1/mo-prod/images/46/4656723b-d8b4-4ac6-9415-0f00a9b3b313?rule=mo-1600",
      "local_path": "foto/11.jpg",
      "is_cover": false
    },
    {
      "index": 12,
      "original_url": "https://img.classistatic.de/api/v1/mo-prod/images/f6/f6c67263-093f-42e6-aa35-cec336963bcd?rule=mo-1600",
      "local_path": "foto/12.jpg",
      "is_cover": false
    },
    {
      "index": 13,
      "original_url": "https://img.classistatic.de/api/v1/mo-prod/images/ff/ffb63508-1502-4572-848f-a1d5c3be9541?rule=mo-1600",
      "local_path": "foto/13.jpg",
      "is_cover": false
    },
    {
      "index": 14,
      "original_url": "https://img.classistatic.de/api/v1/mo-prod/images/b0/b0e17cba-7127-4c7f-9925-516ca55a7efb?rule=mo-1600",
      "local_path": "foto/14.jpg",
      "is_cover": false
    },
    {
      "index": 15,
      "original_url": "https://img.classistatic.de/api/v1/mo-prod/images/84/84619dd1-18ef-468b-a99d-dae1c6d53248?rule=mo-1600",
      "local_path": "foto/15.jpg",
      "is_cover": false
    }
  ],
  "warnings": []
}